{
  "schemaVersion": "1",
  "package": "@stynx-internal/migration-linter",
  "level": "unit",
  "runner": "node-test",
  "status": "passed",
  "startedAt": "2026-05-19T15:55:29.742Z",
  "endedAt": "2026-05-19T15:55:45.213Z",
  "durationMs": 15471,
  "exitCode": 0,
  "signal": null,
  "artifacts": {
    "raw": ".test-results/unit.log"
  },
  "env": {
    "node": "24.15.0",
    "ci": false
  },
  "command": {
    "argv": ["node", "--test", "dist/test/migration-linter.spec.js"],
    "cwd": "/Users/aarusso/Development/stech/stynx/tools/migration-linter"
  },
  "metric": {
    "kind": "none"
  },
  "totals": {
    "files": 0,
    "tests": 22,
    "passed": 22,
    "failed": 0,
    "skipped": 0,
    "todo": 0
  }
}
