{
  "schemaVersion": "1",
  "package": "@stynx-web/angular-audit",
  "level": "mutation",
  "runner": "stryker-vitest",
  "runnerVersion": "3.2.4",
  "status": "passed",
  "startedAt": "2026-05-20T04:16:29.731Z",
  "endedAt": "2026-05-20T04:17:08.393Z",
  "durationMs": 38662,
  "exitCode": 0,
  "signal": null,
  "artifacts": {
    "raw": ".test-results/mutation.log",
    "report": "reports/mutation/mutation.json",
    "html": "reports/mutation/-stynx-web-angular-audit/index.html"
  },
  "env": {
    "node": "24.15.0",
    "ci": false
  },
  "command": {
    "argv": [
      "pnpm",
      "exec",
      "stryker",
      "run",
      "stryker.conf.mjs"
    ],
    "cwd": "/Users/aarusso/Development/stech/stynx/packages-web/angular-audit"
  },
  "metric": {
    "kind": "score",
    "score": 95.1219512195122,
    "thresholds": {
      "high": 70,
      "low": 60,
      "break": 70
    }
  },
  "totals": {
    "files": 3,
    "tests": 60,
    "passed": 39,
    "failed": 2,
    "skipped": 0,
    "todo": 0
  }
}
