{
  "schemaVersion": "1",
  "package": "@stynx-web/angular",
  "level": "unit",
  "runner": "vitest",
  "runnerVersion": "3.2.4",
  "status": "passed",
  "startedAt": "2026-05-20T17:14:31.191Z",
  "endedAt": "2026-05-20T17:14:32.496Z",
  "durationMs": 1305,
  "exitCode": 0,
  "signal": null,
  "artifacts": {
    "raw": ".test-results/unit.log",
    "junit": ".test-results/unit.junit.xml"
  },
  "env": {
    "node": "24.15.0",
    "ci": false
  },
  "command": {
    "argv": [
      "vitest",
      "run",
      "--config",
      "./vitest.config.ts",
      "--reporter=default",
      "--reporter=json",
      "--outputFile.json=/var/folders/5c/m4tbc9kj091cw8v71dnxtrt00000gn/T/vitest-38511-1779297271191.json",
      "--reporter=junit",
      "--outputFile.junit=/Users/aarusso/Development/stech/stynx/packages-web/angular/.test-results/unit.junit.xml"
    ],
    "cwd": "/Users/aarusso/Development/stech/stynx/packages-web/angular"
  },
  "metric": {
    "kind": "none"
  },
  "totals": {
    "files": 1,
    "tests": 19,
    "passed": 19,
    "failed": 0,
    "skipped": 0,
    "todo": 0
  },
  "slowestTests": [
    {
      "name": "@stynx-web/angular renders the empty-state component with input-driven copy and tone",
      "file": "/Users/aarusso/Development/stech/stynx/packages-web/angular/test/stynx-angular.spec.ts",
      "durationMs": 32.54554200000007
    },
    {
      "name": "@stynx-web/angular applies request-id, tenant, and auth headers and refreshes after 401",
      "file": "/Users/aarusso/Development/stech/stynx/packages-web/angular/test/stynx-angular.spec.ts",
      "durationMs": 3.9386670000000095
    },
    {
      "name": "@stynx-web/angular passes unauthenticated mapped 401 errors through without refresh",
      "file": "/Users/aarusso/Development/stech/stynx/packages-web/angular/test/stynx-angular.spec.ts",
      "durationMs": 2.2434580000000324
    },
    {
      "name": "@stynx-web/angular resolves tenant context from query, subdomain, then default resolver",
      "file": "/Users/aarusso/Development/stech/stynx/packages-web/angular/test/stynx-angular.spec.ts",
      "durationMs": 2.1261670000000095
    },
    {
      "name": "@stynx-web/angular passes auth through when bearer mode is disabled and shows a re-login action when refresh is empty",
      "file": "/Users/aarusso/Development/stech/stynx/packages-web/angular/test/stynx-angular.spec.ts",
      "durationMs": 1.8390419999999494
    },
    {
      "name": "@stynx-web/angular provides standalone stynx defaults with feature-provider overrides",
      "file": "/Users/aarusso/Development/stech/stynx/packages-web/angular/test/stynx-angular.spec.ts",
      "durationMs": 1.8210840000000417
    },
    {
      "name": "@stynx-web/angular registers module error mapping outside auth refresh handling",
      "file": "/Users/aarusso/Development/stech/stynx/packages-web/angular/test/stynx-angular.spec.ts",
      "durationMs": 1.3721249999999827
    },
    {
      "name": "@stynx-web/angular tracks toast service signal and observable lifecycles",
      "file": "/Users/aarusso/Development/stech/stynx/packages-web/angular/test/stynx-angular.spec.ts",
      "durationMs": 1.2930410000000165
    },
    {
      "name": "@stynx-web/angular refreshes after a mapped unauthorized SDK error",
      "file": "/Users/aarusso/Development/stech/stynx/packages-web/angular/test/stynx-angular.spec.ts",
      "durationMs": 1.2493749999999864
    },
    {
      "name": "@stynx-web/angular maps HTTP error context and omits falsy status from banners",
      "file": "/Users/aarusso/Development/stech/stynx/packages-web/angular/test/stynx-angular.spec.ts",
      "durationMs": 1.2446669999999358
    }
  ]
}
