{
  "schemaVersion": "1",
  "package": "@stynx/ratelimit",
  "level": "coverage",
  "runner": "vitest",
  "status": "passed",
  "startedAt": "2026-05-19T04:36:59.836Z",
  "endedAt": "2026-05-19T04:36:59.836Z",
  "durationMs": 0,
  "exitCode": 0,
  "signal": null,
  "totals": {
    "files": 7,
    "tests": 0,
    "passed": 0,
    "failed": 0,
    "skipped": 0,
    "todo": 0
  },
  "metric": {
    "kind": "coverage",
    "coverage": {
      "lines": 100,
      "branches": 100,
      "functions": 100,
      "statements": 100
    }
  },
  "artifacts": {
    "coverage": "../../coverage/coverage-final.json"
  },
  "env": {
    "node": "24.15.0",
    "ci": false
  }
}
