{
  "schemaVersion": "1",
  "package": "@stynx/backend",
  "level": "unit",
  "runner": "vitest",
  "runnerVersion": "3.2.4",
  "status": "passed",
  "startedAt": "2026-05-20T03:43:39.735Z",
  "endedAt": "2026-05-20T03:44:22.281Z",
  "durationMs": 42546,
  "exitCode": 0,
  "signal": null,
  "artifacts": {
    "raw": ".test-results/unit.log",
    "junit": ".test-results/unit.junit.xml"
  },
  "env": {
    "node": "24.15.0",
    "ci": false
  },
  "command": {
    "argv": [
      "vitest",
      "run",
      "--config",
      "./vitest.config.ts",
      "--reporter=default",
      "--reporter=json",
      "--outputFile.json=/tmp/vitest-48706-1779248619735.json",
      "--reporter=junit",
      "--outputFile.junit=/Users/aarusso/Development/stech/stynx/packages/backend/.test-results/unit.junit.xml"
    ],
    "cwd": "/Users/aarusso/Development/stech/stynx/packages/backend"
  },
  "metric": {
    "kind": "none"
  },
  "totals": {
    "files": 25,
    "tests": 232,
    "passed": 232,
    "failed": 0,
    "skipped": 0,
    "todo": 0
  },
  "slowestTests": [
    {
      "name": "PormIdentityAdminFacade getBySub() resolves username via getUserBySubject then composes",
      "file": "/Users/aarusso/Development/stech/stynx/packages/backend/test/unit/integration-facades.spec.ts",
      "durationMs": 132.42729200000008
    },
    {
      "name": "IdentityAdminService passes through non-IdentityAdminError throws unchanged",
      "file": "/Users/aarusso/Development/stech/stynx/packages/backend/test/unit/identity-admin.service.spec.ts",
      "durationMs": 106.18700000000013
    },
    {
      "name": "@stynx/backend exports surface for identity-admin barrel surfaces at least one export",
      "file": "/Users/aarusso/Development/stech/stynx/packages/backend/test/unit/identity-admin-export.spec.ts",
      "durationMs": 50.30616699999882
    },
    {
      "name": "PormIdentityAdminFacade get() composes user details + group names",
      "file": "/Users/aarusso/Development/stech/stynx/packages/backend/test/unit/integration-facades.spec.ts",
      "durationMs": 43.790457999999944
    },
    {
      "name": "PormIdentityAdminFacade update() treats email as independently updatable",
      "file": "/Users/aarusso/Development/stech/stynx/packages/backend/test/unit/integration-facades.spec.ts",
      "durationMs": 27.594541000000163
    },
    {
      "name": "PecIdentityAdminFacade describes branch: PEC listAllGroups omits next token when absent",
      "file": "/Users/aarusso/Development/stech/stynx/packages/backend/test/unit/integration-facades.spec.ts",
      "durationMs": 14.77975000000015
    },
    {
      "name": "@stynx/backend exports surface for db-context barrel surfaces at least one export",
      "file": "/Users/aarusso/Development/stech/stynx/packages/backend/test/unit/db-context-export.spec.ts",
      "durationMs": 14.073041999999987
    },
    {
      "name": "PormIdentityAdminFacade update() passes through every present field to updateUser",
      "file": "/Users/aarusso/Development/stech/stynx/packages/backend/test/unit/integration-facades.spec.ts",
      "durationMs": 10.098124999999982
    },
    {
      "name": "ClaimFirstTenantEntitlementPolicy grants when a string claim contains the tenantId",
      "file": "/Users/aarusso/Development/stech/stynx/packages/backend/test/unit/tenant-entitlement.spec.ts",
      "durationMs": 9.332416999999964
    },
    {
      "name": "@stynx/backend exports surface for audit barrel surfaces at least one export",
      "file": "/Users/aarusso/Development/stech/stynx/packages/backend/test/unit/audit-export.spec.ts",
      "durationMs": 8.177666999999929
    }
  ]
}
