{
  "schemaVersion": "1",
  "package": "@stynx-web/angular-trash",
  "level": "unit",
  "runner": "vitest",
  "runnerVersion": "3.2.4",
  "status": "passed",
  "startedAt": "2026-05-19T15:49:18.620Z",
  "endedAt": "2026-05-19T15:49:35.138Z",
  "durationMs": 16518,
  "exitCode": 0,
  "signal": null,
  "artifacts": {
    "raw": ".test-results/unit.log",
    "junit": ".test-results/unit.junit.xml"
  },
  "env": {
    "node": "24.15.0",
    "ci": false
  },
  "command": {
    "argv": [
      "vitest",
      "run",
      "--config",
      "./vitest.config.ts",
      "--reporter=default",
      "--reporter=json",
      "--outputFile.json=/tmp/vitest-22619-1779205758620.json",
      "--reporter=junit",
      "--outputFile.junit=/Users/aarusso/Development/stech/stynx/packages-web/angular-trash/.test-results/unit.junit.xml"
    ],
    "cwd": "/Users/aarusso/Development/stech/stynx/packages-web/angular-trash"
  },
  "metric": {
    "kind": "none"
  },
  "totals": {
    "files": 1,
    "tests": 4,
    "passed": 4,
    "failed": 0,
    "skipped": 0,
    "todo": 0
  },
  "slowestTests": [
    {
      "name": "@stynx-web/angular-trash supports provider-backed components, tabs, filters, bulk actions, and retention countdowns",
      "file": "/Users/aarusso/Development/stech/stynx/packages-web/angular-trash/test/angular-trash.spec.ts",
      "durationMs": 417.06733299999905
    },
    {
      "name": "@stynx-web/angular-trash ships a default SDK adapter provider and multiplexes configured kinds",
      "file": "/Users/aarusso/Development/stech/stynx/packages-web/angular-trash/test/angular-trash.spec.ts",
      "durationMs": 266.02100000000064
    },
    {
      "name": "@stynx-web/angular-trash loads trash items and restores them through the adapter",
      "file": "/Users/aarusso/Development/stech/stynx/packages-web/angular-trash/test/angular-trash.spec.ts",
      "durationMs": 21.157499999999345
    },
    {
      "name": "@stynx-web/angular-trash handles pagination, cascade restore, hard delete, and fallback errors",
      "file": "/Users/aarusso/Development/stech/stynx/packages-web/angular-trash/test/angular-trash.spec.ts",
      "durationMs": 3.818375000000742
    }
  ]
}
