{
  "schemaVersion": "1",
  "package": "stynx-workspace",
  "level": "perf",
  "runner": "perf-smoke",
  "status": "passed",
  "startedAt": "2026-05-19T03:42:35.404Z",
  "endedAt": "2026-05-19T03:42:53.922Z",
  "durationMs": 18517,
  "exitCode": 0,
  "signal": null,
  "artifacts": {
    "raw": ".test-results/perf.log"
  },
  "env": {
    "node": "26.0.0",
    "ci": false
  },
  "command": {
    "argv": ["node", "scripts/perf-smoke.mjs"],
    "cwd": "/Users/aarusso/Development/stech/stynx"
  },
  "metric": {
    "kind": "perf",
    "perf": {
      "p50Ms": 3619,
      "p95Ms": 4091,
      "rps": 0.28,
      "samples": 5
    }
  }
}
