{
  "schemaVersion": "1",
  "package": "@stynx/logging",
  "level": "unit",
  "runner": "vitest",
  "runnerVersion": "3.2.4",
  "status": "passed",
  "startedAt": "2026-05-19T04:25:14.700Z",
  "endedAt": "2026-05-19T04:25:21.723Z",
  "durationMs": 7022,
  "exitCode": 0,
  "signal": null,
  "artifacts": {
    "raw": ".test-results/unit.log",
    "junit": ".test-results/unit.junit.xml"
  },
  "env": {
    "node": "26.0.0",
    "ci": false
  },
  "command": {
    "argv": [
      "vitest",
      "run",
      "--config",
      "./vitest.config.ts",
      "--reporter=default",
      "--reporter=json",
      "--outputFile.json=/var/folders/5c/m4tbc9kj091cw8v71dnxtrt00000gn/T/vitest-46026-1779164714699.json",
      "--reporter=junit",
      "--outputFile.junit=/Users/aarusso/Development/stech/stynx/packages/logging/.test-results/unit.junit.xml"
    ],
    "cwd": "/Users/aarusso/Development/stech/stynx/packages/logging"
  },
  "metric": {
    "kind": "none"
  },
  "totals": {
    "files": 6,
    "tests": 23,
    "passed": 23,
    "failed": 0,
    "skipped": 0,
    "todo": 0
  },
  "slowestTests": [
    {
      "name": "StynxLoggingModule wires default options and applies the request middleware",
      "file": "/Users/aarusso/Development/stech/stynx/packages/logging/test/unit/logging.module.spec.ts",
      "durationMs": 87.02879200000007
    },
    {
      "name": "RequestLogFieldFactory projects active request context fields",
      "file": "/Users/aarusso/Development/stech/stynx/packages/logging/test/unit/pino.factory.spec.ts",
      "durationMs": 21.959874999999556
    },
    {
      "name": "createPinoLogger redacts sensitive values",
      "file": "/Users/aarusso/Development/stech/stynx/packages/logging/test/unit/pino.factory.spec.ts",
      "durationMs": 18.276041999999507
    },
    {
      "name": "createPinoLogger refuses an empty redact list in production",
      "file": "/Users/aarusso/Development/stech/stynx/packages/logging/test/unit/pino.factory.spec.ts",
      "durationMs": 15.299292000000605
    },
    {
      "name": "RequestLoggingMiddleware logs one request completion record for non-health routes",
      "file": "/Users/aarusso/Development/stech/stynx/packages/logging/test/unit/request-logging.middleware.spec.ts",
      "durationMs": 12.914334000000053
    },
    {
      "name": "LoggingDedupeService reports the suppressed duplicate count when the window rolls over",
      "file": "/Users/aarusso/Development/stech/stynx/packages/logging/test/unit/dedupe.spec.ts",
      "durationMs": 10.597125000000233
    },
    {
      "name": "StynxLogger.log/warn/debug/verbose verbose emits at trace level",
      "file": "/Users/aarusso/Development/stech/stynx/packages/logging/test/unit/logger.service.spec.ts",
      "durationMs": 5.905249999999796
    },
    {
      "name": "createPinoLogger uses the development pretty transport when no destination is injected outside production",
      "file": "/Users/aarusso/Development/stech/stynx/packages/logging/test/unit/pino.factory.spec.ts",
      "durationMs": 5.458958000000166
    },
    {
      "name": "RequestLogFieldFactory omits optional request context fields when they are unset",
      "file": "/Users/aarusso/Development/stech/stynx/packages/logging/test/unit/pino.factory.spec.ts",
      "durationMs": 5.21979199999987
    },
    {
      "name": "StynxLogger.error edge cases suppresses error log when dedupe says so",
      "file": "/Users/aarusso/Development/stech/stynx/packages/logging/test/unit/logger.service.spec.ts",
      "durationMs": 4.229583000000275
    }
  ]
}
