{
  "schemaVersion": "1",
  "package": "stynx-db-tests",
  "level": "unit",
  "runner": "vitest",
  "runnerVersion": "3.2.4",
  "status": "passed",
  "startedAt": "2026-05-19T15:54:45.087Z",
  "endedAt": "2026-05-19T15:55:09.374Z",
  "durationMs": 24287,
  "exitCode": 0,
  "signal": null,
  "artifacts": {
    "raw": ".test-results/unit.log",
    "junit": ".test-results/unit.junit.xml"
  },
  "env": {
    "node": "24.15.0",
    "ci": false
  },
  "command": {
    "argv": [
      "vitest",
      "run",
      "--config",
      "./vitest.config.ts",
      "--reporter=default",
      "--reporter=json",
      "--outputFile.json=/tmp/vitest-35819-1779206085087.json",
      "--reporter=junit",
      "--outputFile.junit=/Users/aarusso/Development/stech/stynx/test/db/.test-results/unit.junit.xml"
    ],
    "cwd": "/Users/aarusso/Development/stech/stynx/test/db"
  },
  "metric": {
    "kind": "none"
  },
  "totals": {
    "files": 16,
    "tests": 54,
    "passed": 54,
    "failed": 0,
    "skipped": 0,
    "todo": 0
  },
  "slowestTests": [
    {
      "name": "auth touch triggers updates auth.tenancies.updated_at on UPDATE and leaves it stable on INSERT",
      "file": "/Users/aarusso/Development/stech/stynx/test/db/runtime/auth/touch-triggers.runtime.spec.ts",
      "durationMs": 500.68766700000015
    },
    {
      "name": "audit hash-chain runtime behavior formats timestamps, computes hashes, and sets pinned row hashes on insert",
      "file": "/Users/aarusso/Development/stech/stynx/test/db/runtime/audit/hash-chain.runtime.spec.ts",
      "durationMs": 500.1698329999999
    },
    {
      "name": "auth tenant context runtime helpers enforces tenant_id through auth.attach_tenant_enforcement_triggers and auth.apply_tenant_id",
      "file": "/Users/aarusso/Development/stech/stynx/test/db/runtime/auth/tenant-context.runtime.spec.ts",
      "durationMs": 487.0087079999994
    },
    {
      "name": "storage.files runtime behavior fires storage.touch_updated_at on update and leaves explicit insert timestamps untouched",
      "file": "/Users/aarusso/Development/stech/stynx/test/db/runtime/storage/files-touch.runtime.spec.ts",
      "durationMs": 452.7797499999997
    },
    {
      "name": "audit DML trigger runtime behavior fn_log_dml records INSERT, UPDATE, and DELETE through audit.attach_dml_triggers",
      "file": "/Users/aarusso/Development/stech/stynx/test/db/runtime/audit/log-dml.runtime.spec.ts",
      "durationMs": 431.38629200000014
    },
    {
      "name": "storage.files runtime behavior inserts a storage file with generated identity, defaults, and current-tenant enforcement",
      "file": "/Users/aarusso/Development/stech/stynx/test/db/runtime/storage/files-touch.runtime.spec.ts",
      "durationMs": 425.88595799999985
    },
    {
      "name": "audit.events tenant_scope RLS runtime behavior limits non-owner reads to auth.current_tenant plus tenantless audit events",
      "file": "/Users/aarusso/Development/stech/stynx/test/db/runtime/audit/tenant-scope.runtime.spec.ts",
      "durationMs": 425.1249170000001
    },
    {
      "name": "auth runtime RLS policies filters auth.user_roles through user_roles_isolation",
      "file": "/Users/aarusso/Development/stech/stynx/test/db/runtime/auth/rls-policies.runtime.spec.ts",
      "durationMs": 397.81575000000066
    },
    {
      "name": "auth runtime RLS policies filters auth.tenancies through the tenant_isolation policy",
      "file": "/Users/aarusso/Development/stech/stynx/test/db/runtime/auth/rls-policies.runtime.spec.ts",
      "durationMs": 389.9641249999995
    },
    {
      "name": "auth tenant context runtime helpers sets and clears user, role, language, and tenant context on the current connection",
      "file": "/Users/aarusso/Development/stech/stynx/test/db/runtime/auth/tenant-context.runtime.spec.ts",
      "durationMs": 360.4700410000005
    }
  ]
}
